,Unnamed: 0,doi,publication,publisher,title,year,Abstract
221,221,10.1021/acsami.0c02862,,,"""double-Acceptor-Type"" Random Conjugated Terpolymer Donors for Additive-Free Non-Fullerene Organic Solar Cells",2020,"Random conjugated terpolymers (RCTs) not only promote great comprehension and realization for state-of-the-art high effective non-fullerene polymer solar cells (NF-PSCs) but also offer a simple and practical synthetic strategy. However, the photovoltaic properties of RCTs yet lagged behind that of donor-Acceptor alternating copolymer, especially in the additive-free devices. Hence, we developed two feasible ""double acceptor type"" random conjugated terpolymers, PBDB-TAZ20 and PBDB-TAZ40. PBDB-TAZ20: ITIC and PBDB-TAZ40:ITIC based additive-free NF-PSCs exhibit decent PCEs of 12.34% and 11.27%, respectively, more superior to the PBDB-T:ITIC-based device. For the RCTs, the reasonably weakened crystallinity and optimized phase separation degree are demonstrated to help improve charge transport, reduce bimolecular recombination and thus enhance the photovoltaic performance of additive-free NF-PSCs. The results imply that adding a third moiety into the D-A polymer donors provides a simple yet efficient synthetic methodology for high-performance NF-PSCs."
222,222,10.1002/cphc.202000176,,,Pronounced Dependence of All-Polymer Solar Cells Photovoltaic Performance on the Alkyl Substituent Patterns in Large Bandgap Polymer Donors,2020,"For all-polymer solar cells, the effect of alkyl side chains on photovoltaic performance is a matter of some debate, and this effect remains difficult to forecast. In this concise contribution, we demonstrate that three alkyls namely branched alkyl 2-butyloctyl (2BO), long linear alkyl n-dodecyl (C12), and double-short linear alkyl n-hexyls (DC6) incorporated into the side chains of large bandgap polymer donor PBDT-TTz can induce considerable, of significance, and different electronic, optical, and morphological parameters. Systematic studies shed light on the critical role of the double-short linear alkyl n-hexyls (DC6) in (i) producing large ionization potential value, (ii) increasing propensity of the polymer to order along the π-stacking direction, (iii) generating polymer crystallites with more preferential ""face-on"" orientation, consequently, (iv) improvement of carriers transportation, (v) suppression of charge recombination in all-polymer devices. In parallel, we unearth that the PBDT-TTz with double-short linear alkyl n-hexyls (DC6) represents highest efficiency of 8.3%, whereas, the other two PBDT-TTz analogues (2BO, C12) yield efficiencies of less than 3% in optimized all-polymer solar cells. Though branched or long linear alkyl side chains (2BO, C12) have been applied to provide the solution processability of conjugated polymers, motifs bearing multiple short linear alkyl substituents (DC6) are proved critical to the development of high performing polymers."
225,225,10.3390/ma13102411,,,Distributions of potential and contact-induced charges in conventional organic photovoltaics,2020,"The interfaces of dissimilar materials play central roles in photophysical events in organic photovoltaics (OPVs). Depth profiles of electrostatic potential and contact-induced charges determine the energy-level lineup of the frontier orbitals at electrode/organic and organic heterointerfaces. They are critical for the elementary processes in an OPV cell, such as generation and diffusion of free carriers. A simple electrostatic model describes the energetics in organic heterojunctions supported by an electrode, and experiments via photoelectron spectroscopy and the Kelvin probe method validate the potential distribution in the stacking direction of the device. A comparative study has clarified the significance of Fermi-level pinning and resulting electrostatic fields in determining the energy-level alignment. In this review, we discuss how parameters of device constituents affect the distributions of potential and the dark charges in conventional OPVs comprising metallophthalocyanine and C60 as donor and acceptor, respectively. The results of previous studies, together with additional numerical simulations, suggest that a number of the factors influence the depth profiles of the dark charge and potential, such as the work function of bottom materials, layer thickness, structural inhomogeneity at interfaces, top electrode, and stacking sequence."
226,226,10.3390/ma13102292,,,Investigations of new phenothiazine-based compounds for dye-sensitized solar cells with theoretical insight,2020,"New D-π-D-π-A low-molecular-weight compounds, based on a phenothiazine scaffold linked via an acetylene unit with various donor moiety and cyanoacrylic acid anchoring groups, respectively, were successfully synthesized. The prepared phenothiazine dyes were entirely characterized using nuclear magnetic resonance (NMR) spectroscopy and elemental analysis. The compounds were designed to study the relationship between end-capping donor groups’ structure on their optoelectronic and thermal properties as well as the dye-sensitized solar cells’ performance. The effect of π-conjugation enlargement by incorporation of different heterocyclic substituents possessing various electron–donor affinities was systematically experimentally and theoretically examined. Density functional theory (DFT) and time-dependent density functional theory (TD-DFT) calculations were implemented to determine the electronic properties of the novel molecules."
227,227,10.3390/ma13092068,,,Donor/acceptor photovoltaic cells fabricated on p-doped organic single-crystal substrates,2020,"In this study, the operation of donor/acceptor photovoltaic cells fabricated on homoepitaxially grown p-doped rubrene single-crystal substrates is demonstrated. The photocurrent density is dominated by the sheet conductivity (σ□) of the p-type single-crystal layer doped to 100 ppm with an iron chloride (Fe2Cl6) acceptor. A 65 μm thick p-type rubrene single-crystal substrate is expected to be required for a photocurrent density of 20 mA·cm−2. An entire bulk doping technique for rubrene single crystals is indispensable for the fabrication of practical organic single-crystal solar cells."
228,228,10.3390/molecules25092200,,,Tackling performance challenges in organic photovoltaics: An overview about compatibilizers,2020,"Organic Photovoltaics (OPVs) based on Bulk Heterojunction (BHJ) blends are a mature technology. Having started their intensive development two decades ago, their low cost, processability and flexibility rapidly funneled the interest of the scientific community, searching for new solutions to expand solar photovoltaics market and promote sustainable development. However, their robust implementation is hampered by some issues, concerning the choice of the donor/acceptor materials, the device thermal/photo-stability, and, last but not least, their morphology. Indeed, the morphological profile of BHJs has a strong impact over charge generation, collection, and recombination processes; control over nano/microstructural morphology would be desirable, aiming at finely tuning the device performance and overcoming those previously mentioned critical issues. The employ of compatibilizers has emerged as a promising, economically sustainable, and widely applicable approach for the donor/acceptor interface (D/A-I) optimization. Thus, improvements in the global performance of the devices can be achieved without making use of more complex architectures. Even though several materials have been deeply documented and reported as effective compatibilizing agents, scientific reports are quite fragmentary. Here we would like to offer a panoramic overview of the literature on compatibilizers, focusing on the progression documented in the last decade."
229,229,10.1002/adma.201908373,,,Highly Efficient All-Small-Molecule Organic Solar Cells with Appropriate Active Layer Morphology by Side Chain Engineering of Donor Molecules and Thermal Annealing,2020,"It is very important to fine-tune the nanoscale morphology of donor:acceptor blend active layers for improving the photovoltaic performance of all-small-molecule organic solar cells (SM-OSCs). In this work, two new small molecule donor materials are synthesized with different substituents on their thiophene conjugated side chains, including SM1-S with alkylthio and SM1-F with fluorine and alkyl substituents, and the previously reported donor molecule SM1 with an alkyl substituent, for investigating the effect of different conjugated side chains on the molecular aggregation and the photophysical, and photovoltaic properties of the donor molecules. As a result, an SM1-F-based SM-OSC with Y6 as the acceptor, and with thermal annealing (TA) at 120 °C for 10 min, demonstrates the highest power conversion efficiency value of 14.07%, which is one of the best values for SM-OSCs reported so far. Besides, these results also reveal that different side chains of the small molecules can distinctly influence the crystallinity characteristics and aggregation features, and TA treatment can effectively fine-tune the phase separation to form suitable donor-acceptor interpenetrating networks, which is beneficial for exciton dissociation and charge transportation, leading to highly efficient photovoltaic performance."
230,230,10.1016/j.dyepig.2020.108211,,,Design and structural modification of narrow-bandgap small molecules based on asymmetric porphyrin-diketopyrrolopyrrole backbone for solution-processed organic solar cells,2020,"Abstract Three novel organic small molecules based on asymmetric porphyrin-diketopyrrolopyrrole (DPP) backbone, namely ZnPTDPP, ZnPTDPPCN and ZnPTDPPO, have been designed and synthesized for solution-processed organic solar cells (OSCs). The terminal units of 4-cyanophenyl and 4-methoxyphenyl were introduced into ZnPTDPPCN and ZnPTDPPO respectively, and the structural modification effects on photoelectric and photovoltaic performance were fully investigated. Depending on the characteristics of porphyrin and DPP, all three molecules possess narrow bandgaps of lower than 1.50 eV, showing excellent absorption properties. Structural modification of terminal groups can effectively regulate energy levels of ZnPTDPPCN and ZnPTDPPO. As expected, extended molecular structure from D-A type to D-A-A1 or D-A-D1 type, was conducive to enlarging the π-conjugation and affecting the push-pull effect of intramolecular electrons, thus affecting the photoelectric character of materials. Solution-processed OSCs employing these molecules as the donor materials and PC61BM as the acceptor material were fabricated. It was worth mentioning that devices based on materials ZnPTDPPCN and ZnPTDPPO achieved moderate power conversion efficiencies (PCEs) of 4.26% and 4.24%, respectively, while ZnPTDPP showed an inferior PCE of 1.46%. To our knowledge, the work based on asymmetric porphyrin-DPP backbone for solution-processed OSCs, is first reported. The work will provide valuable hints for rational design of asymmetric porphyrin-based donor materials."
231,231,10.1007/s10118-020-2369-y,,,Conjugated Polymers as Hole Transporting Materials for Solar Cells,2020,"In principle, conjugated polymers can work as electron donors and thus as low-cost p-type organic semiconductors to transport holes in photovoltaic devices. With the booming interests in high-efficiency and low-cost solar cells to tackle global climate change and energy shortage, hole transporting materials (HTMs) based on conjugated polymers have received increasing attention in the past decade. In this perspective, recent advances in HTMs for a range of photovoltaic devices including dye-sensitized solar cells (DSSCs), perovskite solar cells (PSCs), and silicon (Si)/organic heterojunction solar cells (HSCs) are summarized and perspectives on their future development are also presented."
232,232,10.1039/d0tc00154f,,,The influence of the terminal acceptor and oligomer length on the photovoltaic properties of A-D-A small molecule donors,2020,"Four new A–D–A small molecules (denoted as FG1–4) have been designed and synthesized. The compounds have cyclopentadithiophene-vinylene (CPDTV) oligomers of different lengths as the central donor core linked with different terminal acceptor units (3-ethylrhodanine or dicyanomethylene-3-ethylrhodanine). The effects that conjugation length and terminal acceptor units have on the optical and electrochemical properties were investigated. These small molecules were used as donors in conjunction with PC71BM as an acceptor in the bulk heterojunction active layer for the fabrication of solution-processed organic solar cells. Solvent vapor annealing treatment improved the crystallinity and the interpenetrating networks of donor and acceptor phases for exciton dissociation and charge transfer, thus leading to significant improvements in the overall power conversion efficiency (PCE) of the organic solar cells. The PCE values for the organic solar cells based on the optimized FG1:PC71BM, FG2:PC71BM, FG3:PC71BM and FG4:PC71BM active layer were 5.58%, 6.99%, 7.51% and 8.43%, respectively. These results indicate that an enhancement in the PCE of small molecule organic solar cells can be achieved by an increase in conjugation-length and variation of terminal acceptor units in the molecular backbone of small molecules and optimization of the crystallinity and nanoscale interpenetrating morphology by appropriate solvent vapor annealing treatment."
233,233,10.1021/acsami.0c01382,,,"Effects of a Fluorinated Donor Polymer on the Morphology, Photophysics, and Performance of All-Polymer Solar Cells Based on Naphthalene Diimide-Arylene Copolymer Acceptors",2020,"Naphthalene diimide (NDI)-biselenophene copolymer (PNDIBS) and NDI-selenophene copolymer (PNDIS) and the fluorinated donor polymer PM6 were used to investigate how a fluorinated polymer component affects the morphology and performance of all-polymer solar cells (all-PSCs). Although the PM6:PNDIBS blend system exhibits a high open-circuit voltage (Voc = 0.925 V) and desired low optical bandgap energy loss (Eloss = 0.475 eV), the overall power conversion efficiency (PCE) was 3.1%. In contrast, PM6:PNDIS blends combine a high Voc (0.967 V) with a high fill factor (FF = 0.70) to produce efficient all-PSCs with 9.1% PCE. Furthermore, the high performance PM6:PNDIS all-PSCs could be fabricated by various solution processing approaches and at active layer thickness as high as 300 nm without compromising photovoltaic efficiency. The divergent photovoltaic properties of PNDIS and PNDIBS when paired respectively with PM6 are shown to originate from the starkly different blend morphology and blend photophysics. Efficient PM6:PNDIS blend films were found to exhibit a vertical phase stratification along with lateral phase separation while the molecular packing had a predominant face-on orientation. Bulk lateral phase separation with both face-on and edge-on molecular orientations featured in the poor performing PM6:PNDIBS blend films. Enhanced charge photogeneration and suppressed geminate and bimolecular recombinations with 99% charge collection probability found in PM6:PNDIS blends strongly differ from the poor charge collection probability (66%) and high electron-hole pair recombination seen in PM6:PNDIBS. Our findings demonstrate that beyond the generally expected enhancement of Voc, a fluorinated polymer component in all-PSCs can also exert a positive or negative influence on photovoltaic performance via the blend morphology and blend photophysics."
234,234,10.1109/IRASET48871.2020.9092108,,,Optimization and Simulation of the photovoltaic properties of modified Donor-Acceptor Conjugated Oligomers for Organic Solar Cells,2020,"In this study, the analysis of microelectronic and photonic structure in one dimension program [AMPS-1D] has been successfully used to study organic solar cells. The program was used to optimize the performance of the organic solar cells based on (Carbazole-Methylthiophene), benzothiadiazole, Thiophene [(Cbz-Mth)-B-T]2 and [6, 6] -phenyl-C61-butyric acid methyl ester (PCBM). The cells considered, consist of Carbazole-Methylthiophene-Thiophene as electron donors, and benzothiadiazole, (6,6)-phenyl-c61-butyric acid methyl ester [PCBM] as electron acceptor. [(Cbz-Mth) -BT]2-PCBM] is used as photo active material, sandwiched between a transparent indium tin oxide (ITO) and an Al backside contact. The optoelectronic properties of these dyes were investigated by using the Density Functional Theory DFT/B3LYP/6-31G (d, p) method. We studied the influence of the variation of the thickness of the active layer, the temperature and the density of the effective states of the electrons and the holes in the conduction and valence bands respectively on the performance of the solar cells. The results were compared with the experimental data, it showed that the optimum thickness of the solar cell is about 120 nm, the maximum efficiency for the studied organic solar cell is about 9.458 % and the open circuit voltage decreases with temperature."
236,236,10.1039/c9se01261c,,,"Determining the sequence and backbone structure of ""semi-statistical"" copolymers as donor-acceptor polymers in organic solar cells",2020,"Organic photovoltaics (OPVs) are attracting significant attention due to the growing demand for economically viable and renewable energy sources. With efficiencies exceeding 16.5%, single junction bulk heterojunction (BHJ) devices are amongst the most promising and are nearing commercialisation. One recent avenue of research has focused on statistical conjugated copolymers. However, a detailed investigation as to why these materials can achieve higher power conversion efficiencies than their regular alternating counterparts is seldom reported. This work describes an investigation into donor–acceptor polymers demonstrating how differing monomer activities can lead to differing microstructures in a simple batch reaction, which in turn demonstrates promising optoelectronic and morphological properties required for organic photovoltaic devices. A one pot condensation polymerisation reaction with three monomers leads to an ABA triblock structure from differing monomer reactivities. This structure in turn leads to visualised phase separation which is possibly linked to an increase in performance. Further to this we report on the reliability of the Stille coupling for the synthesis of conjugated polymers."
237,237,10.1007/s11426-019-9684-8,,,"Organic solar cells based on chlorine functionalized benzo[1,2-b:4,5-b′]difuran-benzo[1,2-c:4,5-c′]dithiophene-4,8-dione copolymer with efficiency exceeding 13%",2020,"Benzo[1,2-b:4,5-b′]dithiophene (BDT) has been widely used to construct donor-acceptor (D-A) copolymers in organic solar cells (OSCs). However, benzo[1,2-b:4,5-b′]difuran (BDF), an analogue of BDT, has received less attention than BDT. The photovoltaic performance of BDF copolymers has lagged behind that of BDT copolymers. Here, we designed and synthesized two BDF copolymers, PBF1-C and PBF1-C-2Cl. PBF1-C-2Cl, which is composed of BDF and benzo[1,2-c:4,5-c′]dithiophene-4,8-dione connected by a chlorinated thiophene π-bridge, displays a low-lying highest occupied molecular orbital energy level, which helps in yielding a high open-circuit voltage (Voc) in OSCs. As a result, when blended with Y6, PBF1-C-2Cl-based devices showed a high Voc of 0.83 V and a power conversion efficiency (PCE) of 13.10%. To the best of our knowledge, the PCE of 13.10% is among the highest efficiency values for OSCs based on BDF copolymers."
238,238,10.1016/j.dyepig.2019.108165,,,A new fluorinated pyran-bridged A-D-A type small molecular acceptor for organic solar cells,2020,"Abstract A new fluorinated pyran-bridged A-D-A type small molecular non-fullerene acceptor, i-PTIC-F, is designed and synthesized. The optical and electrochemical properties have been well studied and compared with the non-fluorinated molecule, i-PTIC. The photovoltaic performance of i-PTIC-F is characterized using PBDB-T as the donor material. A reasonable power conversion efficiency of 5.68% is achieved with an enhanced Jsc of 14.56 mA cm−2."
239,239,10.1016/j.dyepig.2019.108099,,,"Novel indeno[1,2-b]indole-spirofluorene donor block for efficient sensitizers in dye-sensitized solar cells",2020,"Abstract Indeno[1,2-b]indole-spirofluorene (IISF) unit has been synthesized and firstly applied as a donor candidate for the sensitizer of dye-sensitized solar cells. Two new dyes JY57 and JY58, based on IISF donor, are consequently constructed, together with dithieno[3,2-b:2′,3′-d]pyrrole (DTP) as π-bridge and cyanoacrylic acid as acceptor. For JY58, additional electron-withdrawing 2,1,3-benzothiadiazole unit is inserted between IISF donor and DTP π-bridge to achieve a broader absorption range. Both dyes show high JSC and good device performance in iodine electrolyte. The photovoltaic properties are further tuned by co-adsorption and co-sensitization strategies, and better PCEs are obtained. Among the series of cells under AM 1.5G irradiation, cells fabricated by the synergic adsorption of JY57, chenodeoxycholic acid and JY59, achieve the highest PCE of 9.56%, which is much higher than 8.46% for N719 at the same condition."
240,240,10.1016/j.dyepig.2019.108083,,,"A systematic evaluation of triisopropylsilylethynyl-substituted thienyl side chain effects on series of benzo[1,2-b:4,5-b′]dithiophene based polymer donors and their photovoltaic performances",2020,"Abstract In this report three new donor copolymers based on alternate octyl 3-fluorothieno[3,4-b]thiophene-2-carboxylate as acceptor and benzo[1,2-b:4,5-b′]dithiophene (BDT) derivatives having triisopropylethynylsilane (TIPS), triisopropyl((thiophen-2-yl)ethynyl)silane (TIPS-Th) and triisopropyl((3-octylthiophen-2-yl)ethynyl)silane (TIPS-ThC8) side chains as donors, (respectively named as P1, P2 and P3) are synthesized to assess whether insertion of thiophene or alkyl thiophene units between TIPS side chains and BDT backbones can improve their properties and photovoltaic performance. Indeed, the modification of TIPS side chains on BDT backbone found to distinctly affect their opto-electrochemical properties, molecular orientations and nanoscale morphologies in resultant polymers. Among the polymers, optimized organic solar cells (OSCs) of P1:PC71BM exhibited best power conversion efficiency (PCE) of 6.55% with a very high VOC of 1.02 V, thereby outperforming P2 and P3 (PCE of 4.72% and 5.47%, respectively). The detailed characterization of optimized blends revealed that this superior device performance of P1:PC71BM blend films attributed to their compact and “face-on” molecular orientation, high hole mobility and superior nanoscale morphology, which minimized voltage loss and leading to an efficient charge transfer with low recombination losses in OCSs. In contrast, lower performances of P2 and P3 were mainly originating from their decreased solubilities caused by the insertion of TIPS-Th or TIPS-ThC8, thereby negatively affecting their molecular weights, morphology and charge carrier mobilities. Thus, these results provide a valuable guideline for designing polymers based on 2-TIPSTh substituted BDT units."
241,241,10.1039/d0tc00541j,,,Single-material organic solar cells with fully conjugated electron-donor alkoxy-substituted bithiophene units and electron-acceptor benzothiadiazole moieties alternating in the main chain,2020,"Main chain conjugated linear polymers, constituted by alternating electron-donor (D) and -acceptor (A) moieties, have been prepared with the aim of testing their performances as photoactive components in single material organic solar cells (SMOSCs). The D moiety is constituted by bithiophene co-units bearing in position 3 of the thiophene ring a hexyloxy, a hexyloxymethyl or a hexyl group, while the A moiety is represented by the benzothiadiazole group. The D–A polymers were obtained in high yield through the poorly demanding oxidative FeCl3 polymerization process – starting, respectively, from the related precursors 4,7-bis(3-hexyloxythiophen-2-yl)benzo[c][2,1,3]thiadiazole, 4,7-bis[3-(6-methoxyhexyl)thiophen-2-yl]benzo[c][2,1,3]thiadiazole and 4,7-bis(3-hexylthiophen-2-yl)benzo[c][2,1,3]thiadiazole – with low dispersity indexes, close to the monodisperse state, after fractionation with methanol. The materials have been thoroughly characterized for their physical and structural properties and then tested for photoconversion efficiency in SMOSCs by using different deposition procedures of the photoactive component. In agreement with Kelvin probe force microscopy (KPFM) measurements, the best photovoltaic performance was observed for the polymer based on conjugated 3-alkoxythiophene and benzothiadiazole moieties, achieving significant photocurrents for this type of fully conjugated alternating D–A structure (Jsc = 2.63–3.72 mA cm−2)."
