,Unnamed: 0,doi,publication,publisher,title,year,Abstract
95,95,10.1039/d0cp05362g,,,Ultrafast channel I and channel II charge generation processes at a nonfullerene donor-acceptor PTB7:PDI interface is crucial for its excellent photovoltaic performance,2021,"Nonfullerene organic solar cells have received much attention in recent years due to their low cost, high absorption coefficient and excellent synthetic flexibility. However, the microscopic photoinduced dynamics at corresponding donor-acceptor interfaces remains unclear. In this work, we have firstly employed state-of-the-art TDDFT-based nonadiabatic dynamics simulations in combination with static electronic structure calculations to explore the ultrafast photoinduced dynamics at a typical nonfullerene donor-acceptor PTB7:PDI interface using a minimal model system (172 atoms). Upon excitation with specific wavelength of light, both PTB7 and PDI can be locally excited to generate |PTB7* and |PDI* excitons due to their high absorption ability and significant overlap in absorption spectrum. After that, these localized excitons gradually convert to charge transfer exciton |PTB7+PDI-, while another |PTB7-PDI+ charge transfer exciton is not involved in the whole process. Along with the exciton conversion, electron transfer from PTB7 to PDI (channel I charge generation) and the hole transfer from PDI to PTB7 (channel II charge generation) occurs simultaneously with time constants of 643 fs and 549 fs respectively. In the same time, D index that measures the centroid distance of electron and hole increases from 1.0 Å to 4.0 Å, which clearly reflects a charge transfer process at the interface. Our present work provides solid evidence that both channel I and channel II charge generation processes play important roles at PTB7:PDI interface, which could be helpful for the design of novel nonfullerene solar cells with better photovoltaic performance."
96,96,10.1039/d0qm00581a,,,Recent progress in reducing voltage loss in organic photovoltaic cells,2021,"Compared with inorganic or perovskite photovoltaic cells, organic photovoltaic (OPV) cells often exhibit larger voltage losses, which hinders improvements in their efficiency. The unwanted voltage losses are mainly caused by the driving force for charge generation and non-radiative recombination. In recent years, with the development of non-fullerene acceptors (NFAs), the voltage losses of OPV cells have been significantly suppressed, contributing to a boost in efficiency. Two aspects help to decrease voltage loss: (1) many OPV cells based on NFAs possess high-efficiency charge generation under aligned energy levels between the donor and acceptor, almost eliminating the driving forces in charge generation; (2) the illumination efficiencies of active layer blends containing NFAs are vastly improved, thus decreasing the non-radiative recombination loss. In this review, we summarize the recent progress achieved in the reduction of voltage losses in OPV cells. First, we present a brief background of voltage loss in different types of photovoltaic cells. Second, we discuss the latest research results, such as the charge generation mechanism under low donor–acceptor energy offsets and how non-radiative loss can be suppressed via tuning the charge transfer state. Finally, we provide insight into the design of highly efficient OPV materials that may be achieved via further decreases in voltage loss."
97,97,10.1021/acsami.0c20389,,,Effect of Side-Chain Modification on the Active Layer Morphology and Photovoltaic Performance of Liquid Crystalline Molecular Materials,2021,"Controlling the nanoscale morphology of the photoactive layer by fine-tuning the molecular structure of semiconducting organic materials is one of the most effective ways to improve the power conversion efficiency of organic solar cells. In this contribution, we investigate the photovoltaic performance of benzodithiophene (BDT)-based p-type small molecules with three different side chains, namely alkyl-thio (BTR-TE), dialkylthienyl (BTR), and trialkylsilyl (BTR-TIPS) moieties substituted on the BDT core, when used alongside a nonfullerene acceptor. The side-chain changes on the BDT core are shown to have a profound effect on energy levels, charge generation, recombination, morphology, and photovoltaic performance of solid-state molecules. Compared with BTR and BTR-TIPS, BTR-TE-based single-junction binary blend solar cells show the best power conversion efficiency (PCE) of 13.2% due to improved morphology and charge transport with suppressed recombination. In addition, we also achieved relatively good performances for ternary blend solar cells with a PCE of 16.1% using BTR-TE as a third component. Our results show that side-chain modification has a significant effect on modulating active layer morphology, and in particular that thioether side-chain modification is an effective way to achieve optimum morphology and performance for organic photovoltaic (OPV) devices."
98,98,10.1039/d0cc07086f,,,Designing high performance conjugated materials for photovoltaic cells with the aid of intramolecular noncovalent interactions,2021,"Organic semiconductors including conjugated polymers and small molecules can be applied in many fields due to their unique advantages, such as light weight, solution processability, easy functionalization etc. During the past ten years, we mainly focused on the design and synthesis of conjugated polymer donor materials and small molecular acceptor materials for organic solar cells and hole transport materials for perovskite solar cells. To obtain planar conjugated polymers, low cost small molecular acceptors, and dopant-free hole transport polymers, we adopted intramolecular noncovalent interactions (INCIs) as the design strategy. In this brief review, we will demonstrate that the INCI strategy is very efficient in the design of high performance photovoltaic materials."
99,99,10.1021/acsapm.0c00772,,,Comparative Study of Selenophene- And Thiophene-Containing n-Type Semiconducting Polymers for High Performance All-Polymer Solar Cells,2021,Effects of the donor moiety substitution on the intrinsic and photovoltaic blend properties of n-type semiconducting naphthalene diimide-arylene copolymers with donor–acceptor structure were invest...
100,100,10.1021/acsapm.0c00748,,,Effects of π-Bridge on Fused-Ring Electron Acceptor Dimers,2021,"Two nonfullerene acceptors (TTIDIC and BTIDIC), consisting of indacenodithiophene (IDT) dimers bridged with electron-rich thienothiophene (TT) or electron-accepting benzothiadiazole (BT), were synt..."
102,102,10.1039/d0dt03737k,,,Electron spin-controlled charge transfer and the resulting long-lived charge transfer state: From transition metal complexes to organic compounds,2021,"The generation of long-lived charge transfer (CT) states in electron donor/acceptor dyads upon photoexcitation is crucial for artificial photosynthesis, photocatalysis and photovoltaics. Electron spin control is a novel strategy to prolong the CT state lifetime via generation of the 3CT triplet state, instead of the traditional short-lived 1CT state. This method involves a local triplet excited state (3LE) as the precursor of charge separation (CS), and the electron forbidden feature of the charge recombination (CR) of 3CT → S0 vs. the electron spin allowed 1CT → S0 prolongs the CT state lifetime. In this article, we summarized the recent developments and challenges in this emerging fascinating area."
105,105,10.1021/acs.jpcb.1c03595,,,Ultrafast Charge Transfer and Relaxation at a Donor-Acceptor Interface,2021,"The efficiency of charge separation in organic photovoltaic materials is crucially determined by the underlying dynamics of the charge transfer (CT) excitons and their dissociation into free electrons and holes. To unravel the main principles of the underlying mechanism on a molecular level, we construct a toy model of electronically coupled donors interacting with a manifold of CT exciton states. In particular, we set up a ladder of CT site energies to model the exciton dissociation. To mimic the complexity of the exciton dynamics at the donor-acceptor interface, the electronic CT manifold is designed to include two vibrational modes that are vibronically coupled to the excitons. We examine the impact of the electronic and vibrational coherences and the structure of the vibronic manifold on the transfer efficiency and charge recombination. Optimal configurations of the vibronic CT manifold are revealed. In particular, the rate of charge recombination can be minimized when the transient dynamics are carefully explored. Such a toy model can be used as a guide for the design of organic materials for efficient photovoltaic devices."
106,106,10.1007/s10854-021-06765-x,,,Influence of thermal annealing on the charge generation and transport in PM6-based non-fullerene solar cells,2021,"To study the influence of thermal annealing on the charge generation and transport in PM6-based non-fullerene solar cells. Morphology, optical and electrochemical properties of active layers as well as electrical properties of polymer solar cells were studied. Furthermore, the photoelectric conversion processes of annealed and unannealed devices were also examined by means of time resolved spectroscopy. The results showed that thermal annealing had a weak influence on the dynamics of exciton states. Besides, annealed device is found to suppress bimolecular recombination owing to its higher charge carrier mobility in ordered donor and acceptor aggregation phases, which led to higher photocurrent and power conversion efficiency than unannealed photovoltaic device."
107,107,10.1080/15685551.2021.1956209,,,Theoretical studies of optoelectronic and photovoltaic properties of D–A polymer monomers by Density Functional Theory (DFT),2021,"ABSTRACT In this research article, the new donor–acceptor (D–A) monomers developed using 4-methoxy-9-methyl-9 H-carbazole (MMCB) as electron donors and various electron acceptors. DFT and TD-DFT methods at the level of B3LYP with a 6–311 G basis set in a gas and chloroform solvent were used to calculate electronic and optoelectronic properties. To dissect the relationship between the molecular and optoelectronic structures, the impacts of specific acceptors on the geometry of molecules and optoelectronic properties of these D–A monomers were discussed. The calculations are also carried out on HOMO–LUMO, atomic orbital densities. The calculated band gap Eg of the monomers considered increases 3,6-MMCB-OCP ≈ 3,6-MMCB-BCO < 3,6-MMCB-SDP < 3,6-MMCB-SCP < 3,6-MMCB-TCP < 3,6-MMCB-TDP < 3,6-MMCB-BCS < 3,6-MMCB-BCT in both in the gas and solvent phases. Subsequently, the optoelectrical properties of EHOMO, ELUMO, Eopt, and EB energies were critically updated. Compared to different monomers, the far lower Eg of the 3,6-MMCB-OCP and 3,6-CB-BCO has shown optoelectronic applications in organic solar cells like BHJ."
109,109,10.1002/cssc.202100799,,,Reducing Non-Radiative Voltage Losses by Methylation of Push–Pull Molecular Donors in Organic Solar Cells,2021,"Organic solar cells are approaching power conversion efficiencies of other thin-film technologies. However, in order to become truly market competitive, the still substantial voltage losses need to be reduced. Here, we describe the synthesis and characterization of four novel arylamine-based push-pull molecular donors, two of them exhibiting a methyl group at the para position of the external phenyl ring of the arylamine block. By assessing the charge-transfer state properties and the effects of methylation on the open-circuit voltage of the device, we show that devices based on methylated versions of the molecular donors exhibit reduced voltage losses due to decreased non-radiative recombination. Modelling suggests that methylation results in a tighter interaction between donor and acceptor molecules, turning into a larger oscillator strength to the charge-transfer states, thereby ensuing reduced non-radiative decay rates."
110,110,10.1002/cssc.202100860,,,13.4 % Efficiency from All-Small-Molecule Organic Solar Cells Based on a Crystalline Donor with Chlorine and Trialkylsilyl Substitutions,2021,"How to simultaneously achieve both high open-circuit voltage ( V oc ) and high short-circuit current density ( J sc ) is a big challenge for realising high power conversion efficiency (PCE) in all-small-molecule organic solar cells (all-SM OSCs). Herein, a novel small molecule (SM)-donor, namely FYSM-SiCl, with trialkylsilyl and chlorine substitutions was designed and synthesized. Compared to the original SM-donor FYSM-H, SM-donor FYSM-Si with trialkylsilyl substitution shows a decreased crystallinity and lower highest occupied molecular orbital (HOMO) level, while FYSM-SiCl has an improved crystallinity, more ordered packing arrangement, significantly lower HOMO level, and predominant ""face-on"" orientation. Matched with a SM-acceptor Y6, the FYSM-SiCl-based all-SM OSCs exhibited both high V oc of 0.85 V and high J sc of 23.7 mA cm -2 , which is rare for all-SM OSCs and can be attributed to the low HOMO level of FYSM-SiCl and the delicate balance between high crystallinity and suitable blend morphology. As a result, FYSM-SiCl achieved a high PCE of 13.4% in all-SM OSCs, which is much higher than those of FYSM-H (10.9%) and FYSM-Si (12.2%). This work demonstrated a promising method for the design of efficient SM-donors by a side-chain engineering strategy via the introduction of trialkylsilyl and chlorine substitutions."
111,111,10.1002/cssc.202100689,,,Synergistic Effects of Chlorination and Branched Alkyl Side Chain on the Photovoltaic Properties of Simple Non-Fullerene Acceptors with Quinoxaline as the Core,2021,"To date, the fused-ring electron acceptors show the best photovoltaic performances, and the development of simple nonfullerene acceptors via intramolecular noncovalent interactions can reduce synthetic costs. In this work, four simple nonfullerene acceptors with an A-D-A'-D-A configuration, QCIC1, QCIC2, QCIC3, and QCIC4, are synthesized. They own the same conjugated backbone (A': quinoxaline; D: cyclopentadithiophene; A: dicyano-indanone) but different halogen atoms and alkyl side chains. Due to the chlorination on the end-groups and the most and/or longest branched alkyl side chains on the backbone, the blended film composed of QCIC3 and donor PBDB-T exhibits the strongest π-π stacking and the most suitable phase-separation domains among the four blended films. Therefore, the QCIC3 based organic solar cells yield the highest power conversion efficiency of 10.55%. This work provides a pathway to optimize the molecular arrangements and enhance the photovoltaic property of simple electron acceptors through subtle chemical modifications."
112,112,10.1038/s41428-021-00497-9,,,Development of semiconducting polymers based on a novel heteropolycyclic aromatic framework,2021,"The choice of appropriate building blocks and the development of new donor and acceptor units are essential for the creation of high-performance donor-acceptor (D-A)-type semiconducting polymers. In addition, the introduction of π-extended aromatic frameworks into polymer main chains is a useful strategy to facilitate dense π-π stacking structures with long-range order in the solid-state, thereby enabling efficient carrier transport in organic electronics. However, such highly π-extended aromatic frameworks have rarely been reported due to the need for multiple steps. This focus review describes the synthesis and characterization of D-A polymers based on three π-extended heteropolycyclic aromatic frameworks, using phenanthro[1,2-b:8,7-b’]dithiophene (PDT) as a weak donor and alkoxy-substituted anthra[1,2‑c:5,6‑c’]bis([1,2,5]thiadiazole) (ATz) and vinylene-bridged 5,6-difluorobenzo[c][1,2,5]thiadiazole (FBTzE) as new thiadiazole-based acceptor units. In addition, their applications to organic electronic devices, such as organic field-effect transistors (OFETs) and organic photovoltaic cells (OPVs), and the detailed relationship between the thin-film structure and device performance in OFETs and OPVs were investigated. These results indicate that these novel π-extended heteropolycyclic aromatic frameworks may serve as building units for the development of wide-bandgap p-type semiconducting polymers for nonfullerene solar cells and low-bandgap n-type semiconducting polymers for OFETs and OPVs. Our recent studies on the development of semiconducting polymers based on three novel π-extended heteropolycyclic aromatic frameworks, using phenanthro[1,2-b:8,7-b’]dithiophene (PDT) as a weak donor and alkoxy-substituted anthra[1,2‑c:5,6‑c’]bis([1,2,5]thiadiazole) (ATz) and vinylene-bridged 5,6-difluorobenzo[c][1,2,5]thiadiazole (FBTzE) as new thiadiazole-based acceptor units are described. Furthermore, their detailed relationships between the thin-film structure and device performance in organic field-effect transistors (OFETs) and organic photovoltaic cells (OPVs) were investigated. These results demonstrated that these novel π-extended heteropolycyclic aromatic frameworks have great potential as building units for high-performance OFETs and OPVs."
113,113,10.1186/s11671-021-03507-0,,,Identification of a bridge-specific intramolecular exciton dissociation pathway in donor–π–acceptor alternating conjugated polymers,2021,"Intramolecular exciton dissociation is critical for high efficient mobile charge carrier generations in organic solar cells. Yet despite much attention, the effects of π bridges on exciton dissociation dynamics in donor–π–acceptor (D-π-A) alternating conjugated polymers remain still unclear. Here, using a combination of femtosecond time-resolved transient absorption (TA) spectroscopy and steady-state spectroscopy, we track ultrafast intramolecular exciton relaxation dynamics in three D-π-A alternating conjugated polymers which were synthesized by Qin's group and named HSD-A, HSD-B, HSD-C. It is found that the addition of thiophene unit as π bridges will lead to the red shift of steady-state absorption spectrum. Importantly, we reveal the existence of a new intramolecular exciton dissociation pathway mediated by a bridge-specific charge transfer (CT′) state with the TA fingerprint peak at 1200 nm in π-bridged HSD-B and HSD-C. This CT′ state results in higher electron capture rates for HSD-B and HSD-C as compared to HSD-A. Depending on the proportion of CT′ state and nongeminate recombination are important step for the understanding of high power conversion efficiencies in HSD-B than in HSD-C. We propose that this bridge-specific exciton dissociation pathway plays an important role in ultrafast intramolecular exciton dissociation of organic photovoltaic material D-π-A alternating conjugated polymers."
114,114,10.1021/acs.jpcc.0c09663,,,Optically Probing Field-Dependent Charge Dynamics in Non-Fullerene Organic Photovoltaics with Small Interfacial Energy Offsets,2021,"Current non-fullerene organic photovoltaics (OPVs) can achieve high photocurrent generation yields with small donor/acceptor energy offsets. However, the effect of varying energy offset on the char..."
116,116,10.1016/j.micron.2020.102981,,,Benefits of direct electron detection and PCA for EELS investigation of organic photovoltaics materials,2021,"Electron energy-loss spectroscopy (EELS) is a powerful tool for imaging chemical variations at the nanoscale. Here, we investigate a polymer/organic small molecule-blend used as absorber layer in an organic solar cell and employ EELS for distinguishing polymer donor and small molecule acceptor domains in the nanostructured blend based on elemental maps of light elements, such as nitrogen, sulfur or fluorine. Especially for beam sensitive samples, the electron dose needs to be limited, therefore optimized acquisition and data processing strategies are required. We compare data acquired on a post-column energy filter with a direct electron detection camera to data from a conventional CCD camera on the same filter and we investigate the impact of statistical data processing methods (principal components analysis, PCA) on acquired spectra and elemental maps extracted from spectrum images. Our work shows, that the quality of spectra on a direct electron detection camera is far superior to conventional CCD imaging, and thereby allows clear identification of ionization edges and the fine structure of these edges. For the quality of the elemental maps, the application of PCA is essential to allow a clear separation between the donor and acceptor phase in the bulk heterojunction absorber layer of a non-fullerene organic solar cell."
117,117,10.1016/j.orgel.2020.105996,,,Benzodithiophene-based wide-bandgap small-molecule donors for organic photovoltaics with large open-circuit voltages,2021,"Abstract We have developed new small-molecule electron donors, SMBDT-S and SMBDT-SF, based on benzo[1,2-b:4,5-b’]dithiophene (BDT) with thiophene side chains as a core unit and rhodanine end-capping units to enhance the open-circuit voltage (Voc), which is one of the factors limiting performance of small-molecule organic photovoltaics (OPVs). The SMBDT-S and SMBDT-SF donor molecules exhibited excellent thermal stability and high crystallinity. SMBDT-S was found to have a wide bandgap of 1.85 eV with the highest occupied molecular orbital (HOMO) energy level of − 5.56 eV. The fluorination in SMBDT-SF led to the same bandgap of 1.86 eV with an even lower-lying HOMO energy level of − 5.72 eV. Both SMBDT-S and SMBDT-SF have large thin-film absorption coefficients of (1.4–1.5) × 105 cm−1. Bulk heterojunction OPV devices based on pairing SMBDT-S and SMBDT-SF respectively with PC71BM electron acceptor showed Voc as high as 1.18 eV, which is among the highest Voc reported for all-small-molecule solar cells. These results demonstrate that introducing fluorine atoms and alkylthio side chains are effective strategies to downshift the HOMO energy level and enhance the Voc in OPVs."
118,118,10.1016/j.jpowsour.2020.228901,,,"Orientation-dependent effects of indeno[1,2-b]indole-spirofluorene donor on photovoltaic performance of D−π−A and D−D−π−A sensitizers",2021,"Abstract Dyes JY70−73 based on indeno[1,2-b]indole-spirofluorene (IISF) donor have been synthesized and applied in dye-sensitized solar cells, two of them feature donor−π−acceptor (D−π−A) configuration and the others adopt a D−D−π−A structure. Orientation-dependent effects of IISF donor are clearly observed in the photovoltaic properties of D−π−A type dyes JY70 and JY72, though close power conversion efficiency (PCE) achieves finally owing to the trade-off effect of open-circuit voltage (VOC) and short-circuit current density (JSC). By contrast, regioisomeric dyes JY71 and JY73 with an auxiliary diphenylamine donor present a significantly different photovoltaic performance. Under the [Co(phen)3]2+/3+ electrolyte, device based on JY73 gives much higher VOC and JSC, hence a greater PCE (7.40%) which is over two times higher than its regioisomeric JY71 (3.31%). Reasons for that have been systematically investigated. Cocktail co-sensitizations of dyes JY73 and JY70/JY72 both promote the PCEs up to over 8%, and device based on JY72&JY73 achieves the highest PCE of 8.32%."
119,119,10.1016/j.solmat.2020.110765,,,Enhanced lifetime of organic photovoltaic diodes achieved by blending with PMMA: Impact of morphology and Donor:Acceptor combination,2021,"In order to realise the potential of organic photovoltaic devices (OPVs) to provide cheap, scalable access to renewable energy, it is necessary to improve their lifetime and cost of encapsulation. The aim of this work is to achieve these aims by blending the donor and acceptor with the commodity polymer, PMMA, to form a ternary blend device with enhanced lifetime. We find that ternary OPV devices prepared in this manner can have up to double the lifetime of the binary control devices to an extent that depends upon the PMMA morphology and the processing additives used. Further, we find that the initial performance of ternary OPVs may decrease (in the case of PTB7-based blends) or slightly increase (in the case of P3HT-based blends) when compared to their binary counterparts, which is hypothesised to be due to donor compatibility with the PMMA. These findings suggest that this approach can be employed in other OPV blend systems and give design rules to maximise the positive impact on device lifetime."
